{"$schema":"https://json-schema.org/draft/2020-12/schema","additionalProperties":false,"properties":{"batch_generation_id":{"type":["string","null"]},"batch_input_fingerprint":{"type":["string","null"]},"classification_fingerprint":{"type":["string","null"]},"consolidation_approval_fingerprint":{"type":["string","null"]},"decision_generation_id":{"type":["string","null"]},"decision_input_fingerprint":{"type":["string","null"]},"diff_fingerprint":{"type":["string","null"]},"mrq_generation_id":{"type":["string","null"]},"plan_fingerprint":{"type":["string","null"]},"schema_version":{"const":"2"},"source_fingerprint":{"type":["string","null"]},"state":{"enum":["unpublished","active"]},"transaction_id":{"type":["string","null"]}},"required":["schema_version","state","mrq_generation_id","source_fingerprint","diff_fingerprint","classification_fingerprint","plan_fingerprint","consolidation_approval_fingerprint","transaction_id","batch_generation_id","batch_input_fingerprint","decision_generation_id","decision_input_fingerprint"],"type":"object"}
