{"batch_generation_id":null,"batch_input_fingerprint":null,"classification_fingerprint":null,"consolidation_approval_fingerprint":null,"decision_generation_id":null,"decision_input_fingerprint":null,"diff_fingerprint":null,"mrq_generation_id":null,"plan_fingerprint":null,"schema_version":"2","source_fingerprint":null,"state":"unpublished","transaction_id":null}
